{
  "$schema": "https://public-agents.com/schemas/tool.schema.json",
  "schemaVersion": 1,
  "slug": "shopify-ucp",
  "name": "Shopify agentic commerce (UCP MCP servers)",
  "kind": "service",
  "status": "active",
  "summary": "Shopify's documented path for AI agents to buy on a person's behalf: UCP-compliant MCP servers for catalog search across every Shopify merchant, carts and checkouts at each merchant's own endpoint, and orders, plus a UCP CLI and an AI Toolkit skill. Three access tiers in the vendor's words: Token (a Dev Dashboard credential), Signed (RFC 9421 signatures) and Anonymous (nothing). Catalog search needs no account (measured). Measured 2026-09-20 and again 2026-10-15 at one merchant: of 13 tools only complete_checkout and get_order refuse an anonymous caller; no valid checkout was attempted.",
  "vendor": {
    "name": "Shopify Inc.",
    "url": "https://www.shopify.com/",
    "kind": "organization"
  },
  "pricing": "unknown",
  "payments": {
    "machinePayable": false,
    "protocols": [],
    "methods": [],
    "humanBilling": "unknown",
    "notes": "2026-09-20: no page read prices agent access to these servers and no 402 protocol is spoken; the tiers gate on identification and rate limits. The money here is the buyer's purchase at the merchant, which this block does not model. Any cost behind the Token tier's credential was not established."
  },
  "agentAccess": {
    "noAccountNeeded": true,
    "auth": "none",
    "notes": "Re-measured 2026-10-15, no credential or signature: the 2026-09-20 gate reproduces at one merchant, 11 of 13 tools answer an argument error and complete_checkout and get_order answer 403. The vendor now adds \"Don't use unauthenticated requests for production traffic\". No valid checkout made."
  },
  "surfaces": {
    "homepage": "https://shopify.dev/docs/agents",
    "docs": "https://shopify.dev/docs/agents",
    "skills": [
      "https://shopify.dev/docs/apps/build/ai-toolkit"
    ],
    "mcp": "https://catalog.shopify.com/api/ucp/mcp",
    "api": "https://shopify.dev/docs/agents/profiles/auth-and-rate-limiting",
    "source": "https://github.com/Shopify/ucp-cli"
  },
  "social": {
    "github": "Shopify",
    "x": "Shopify"
  },
  "domains": [
    "shopify.dev",
    "shopify.com",
    "www.shopify.com"
  ],
  "maintainers": [],
  "provenance": "third-party",
  "jobs": [
    {
      "job": "proc.purchase-on-behalf",
      "summary": "Vendor's agents docs: build commerce agents that act on behalf of buyers over the Universal Commerce Protocol, from catalog discovery through carts, checkouts, buyer hand-off and order tracking. Claim only: catalog search was measured without an account; no cart, checkout or purchase was made.",
      "source": "https://shopify.dev/docs/agents"
    }
  ],
  "created": "2026-09-11",
  "updated": "2026-10-15",
  "version": 7
}
