{
  "$schema": "https://public-agents.com/schemas/tool.schema.json",
  "schemaVersion": 1,
  "slug": "datadog",
  "name": "Datadog",
  "kind": "service",
  "status": "active",
  "summary": "Observability and security monitoring (infrastructure, APM, logs, monitors, incidents), with Bits Investigation (until recently Bits AI SRE), the vendor's on-call agent that investigates every alert as it fires and reports a root cause with a verifiable investigation. For agents it publishes a hosted MCP server over its observability data (logs, metrics, traces, dashboards, monitors, incidents) that authenticates by OAuth 2.0 by default, or by API and application keys for servers and CI; measured 401 with no credentials and no challenge header.",
  "vendor": {
    "name": "Datadog, Inc.",
    "url": "https://www.datadoghq.com/",
    "kind": "organization"
  },
  "pricing": "paid",
  "payments": {
    "machinePayable": false,
    "protocols": [],
    "methods": [],
    "humanBilling": "card-on-file",
    "priceList": "https://www.datadoghq.com/pricing/",
    "notes": "2026-09-21: no surface read prices an agent or speaks a 402 protocol, and the MCP server consumes no AI Credits, which meter only the Bits products. Two human methods are documented, card and invoicing (ACH, wire, check); this field holds one, so it names the card path and the profile carries both."
  },
  "agentAccess": {
    "noAccountNeeded": false,
    "auth": "oauth",
    "notes": "Measured 2026-09-12 and 2026-09-21, no credentials: initialize at mcp.datadoghq.com/v1/mcp (US1) answers 401 with no www-authenticate header; the RFC 9728 document is served anyway, and the authorization-server document names one scope, mcp_all. Vendor: OAuth 2.0 default; 100,000 tool calls a month."
  },
  "surfaces": {
    "homepage": "https://www.datadoghq.com/",
    "docs": "https://docs.datadoghq.com/mcp_server/",
    "llmsTxt": "https://docs.datadoghq.com/llms.txt",
    "mcp": "https://mcp.datadoghq.com/v1/mcp",
    "source": null
  },
  "social": {
    "github": "DataDog",
    "x": "datadoghq"
  },
  "domains": [
    "www.datadoghq.com",
    "datadoghq.com",
    "docs.datadoghq.com",
    "mcp.datadoghq.com"
  ],
  "maintainers": [],
  "provenance": "third-party",
  "jobs": [
    {
      "job": "eng.investigate-incidents",
      "summary": "Bits Investigation, the vendor's words: \"Automatically investigate every alert the moment it fires\", \"Easily root out root causes within minutes\", \"Get clear RCAs with transparent, verifiable investigations\", over the platform's telemetry (re-read 2026-09-21). Not measured; metered in AI Credits.",
      "source": "https://www.datadoghq.com/product/ai/bits-investigation/",
      "sources": [
        "https://docs.datadoghq.com/account_management/billing/ai_credits/"
      ]
    }
  ],
  "created": "2026-09-11",
  "updated": "2026-10-13",
  "version": 4
}
