{
  "$schema": "https://public-agents.com/schemas/tool.schema.json",
  "schemaVersion": 1,
  "slug": "cloudflare-mcp",
  "name": "Cloudflare MCP servers",
  "kind": "service",
  "status": "active",
  "summary": "Cloudflare's catalog of managed remote MCP servers: the Cloudflare API server (2,500+ endpoints behind search and execute tools), fifteen product-specific servers on *.mcp.cloudflare.com (bindings, builds, observability, Radar, browser rendering, logs, AI Gateway, DNS analytics and more), and an Agents SDK Documentation server on agents.cloudflare.com. Two need no authentication, both measured: the Documentation server at docs.mcp.cloudflare.com and the Agents SDK one; the rest require OAuth or a token (two measured 401). Code: mcp-server-cloudflare Apache-2.0, the Agents SDK server MIT.",
  "vendor": {
    "name": "Cloudflare, Inc.",
    "url": "https://www.cloudflare.com/",
    "kind": "organization"
  },
  "license": "Apache-2.0",
  "pricing": "unknown",
  "agentAccess": {
    "noAccountNeeded": true,
    "auth": "none",
    "notes": "Re-measured 2026-09-23 keyless: docs.mcp.cloudflare.com/mcp answers a bare tools/call of search_cloudflare_documentation with source-attributed documentation, not just a handshake (server docs-ai-search 0.4.13, unchanged since 09-12). Account-scoped servers were 401 on 09-12 and were not re-run."
  },
  "surfaces": {
    "homepage": "https://www.cloudflare.com/",
    "docs": "https://developers.cloudflare.com/agents/model-context-protocol/cloudflare/servers-for-cloudflare/",
    "llmsTxt": "https://developers.cloudflare.com/llms.txt",
    "mcp": "https://docs.mcp.cloudflare.com/mcp",
    "source": "https://github.com/cloudflare/mcp-server-cloudflare",
    "skills": [
      "https://github.com/cloudflare/skills"
    ]
  },
  "social": {
    "github": "cloudflare",
    "x": "Cloudflare"
  },
  "domains": [
    "www.cloudflare.com",
    "cloudflare.com",
    "developers.cloudflare.com",
    "docs.mcp.cloudflare.com",
    "mcp.cloudflare.com"
  ],
  "maintainers": [],
  "provenance": "third-party",
  "jobs": [
    {
      "job": "eng.retrieve-reference-context",
      "summary": "Documentation server, the vendor's words on the servers page: \"Get up to date reference information on Cloudflare\", at docs.mcp.cloudflare.com/mcp; its README: \"This public documentation server does not require authentication.\" The keyless access is measured in agentAccess and the profile, not here.",
      "source": "https://developers.cloudflare.com/agents/model-context-protocol/cloudflare/servers-for-cloudflare/",
      "sources": [
        "https://github.com/cloudflare/mcp-server-cloudflare/blob/main/apps/docs-ai-search/README.md"
      ]
    }
  ],
  "created": "2026-09-12",
  "updated": "2026-10-13",
  "version": 4,
  "payments": {
    "machinePayable": false,
    "protocols": [],
    "methods": [],
    "humanBilling": "card-on-file",
    "priceList": "https://www.cloudflare.com/plans/",
    "notes": "Read 2026-09-23: the MCP servers carry no price and speak no 402. Cloudflare's checkout offers 'Crypto' beside card, Apple Pay and Google Pay: USDC on Base and Polygon through a Stripe-hosted wallet connection, with a signed permit for recurring charges and a card on file as fallback."
  }
}
