{
  "$schema": "https://public-agents.com/schemas/tool.schema.json",
  "schemaVersion": 1,
  "slug": "stripe",
  "name": "Stripe",
  "kind": "service",
  "status": "active",
  "summary": "Payments infrastructure: card and bank payments, Billing, Invoicing, Connect for platforms, Issuing, Tax, and Radar, the vendor's fraud product that blocks fraudulent payments and flags suspicious accounts in real time. For agents, the vendor publishes a hosted MCP server at mcp.stripe.com that searches the API and its knowledge base and reads and writes much of the Stripe API; it authenticates by OAuth, or by an agent API key, a tagged restricted key, as a bearer token where a client cannot do OAuth; measured 401 with no credentials.",
  "vendor": {
    "name": "Stripe, Inc.",
    "url": "https://stripe.com/",
    "kind": "organization"
  },
  "pricing": "paid",
  "payments": {
    "machinePayable": false,
    "protocols": [],
    "methods": [],
    "humanBilling": "none",
    "priceList": "https://stripe.com/pricing",
    "notes": "Read 2026-09-19: the MCP server and API keys carry no price of their own and speak no 402 protocol. Stripe's fees are netted from each processed charge before payout (docs.stripe.com/payouts) and disputes debit the balance, so no bill is issued for the tool itself: 'none' is the nearest enum value."
  },
  "agentAccess": {
    "noAccountNeeded": false,
    "auth": "oauth",
    "notes": "Measured 2026-09-11, 09-19 and 09-27, no credentials: MCP initialize at mcp.stripe.com answers 401 with a Bearer challenge naming the resource metadata (its URL unquoted on 09-19, quoted since 09-27); the metadata names access.stripe.com/mcp as the OAuth server. OAuth, or an agent API key as bearer."
  },
  "surfaces": {
    "homepage": "https://stripe.com/",
    "docs": "https://docs.stripe.com/mcp",
    "llmsTxt": "https://docs.stripe.com/llms.txt",
    "mcp": "https://mcp.stripe.com/",
    "source": null
  },
  "social": {
    "github": "stripe",
    "x": "stripe"
  },
  "domains": [
    "stripe.com",
    "docs.stripe.com",
    "mcp.stripe.com"
  ],
  "maintainers": [],
  "provenance": "third-party",
  "jobs": [
    {
      "job": "fin.collect-customer-payment",
      "summary": "Vendor's claim for payments: the charge settles to the business's Stripe balance and \"Stripe sends funds from your available balance to your bank account as payouts\"; the disputes page (docs.stripe.com/disputes) adds \"Stripe debits your balance for the payment amount and dispute fee\".",
      "source": "https://docs.stripe.com/payouts",
      "sources": [
        "https://docs.stripe.com/disputes"
      ]
    },
    {
      "job": "fin.determine-transaction-tax",
      "summary": "Vendor's claim for Stripe Tax, which \"uses your business address, tax registrations, product tax codes, customers' locations, and customer status to determine the correct tax rates\", kept current by \"tax researchers who monitor tax laws\". Limit in the vendor's words: no registration, zero tax.",
      "source": "https://docs.stripe.com/tax/how-tax-works"
    },
    {
      "job": "fin.file-and-remit-tax-returns",
      "summary": "US state sales tax only: the vendor claims \"Automated US filing is available in all 46 US locations with a state-level sales and use tax\" through TaxJar, a Stripe company, remitting from the business's US bank account. Tax Complete plan; outside the US, filing is a partner app.",
      "source": "https://docs.stripe.com/tax/file-with-stripe"
    },
    {
      "job": "fin.issue-invoices",
      "summary": "Amounts recorded in Stripe: the vendor's Invoicing product, where \"You can send invoices to customers to collect payment or you can create an invoice and automatically charge a customer's saved payment method\", with due terms, Stripe Tax treatment and EU/UK-aware sequential numbering.",
      "source": "https://docs.stripe.com/invoicing/overview"
    }
  ],
  "created": "2026-09-11",
  "updated": "2026-10-14",
  "version": 6
}
