{
  "$schema": "https://public-agents.com/schemas/tool.schema.json",
  "schemaVersion": 1,
  "slug": "bitrefill",
  "name": "Bitrefill",
  "kind": "service",
  "status": "active",
  "summary": "Gift cards, mobile top-ups, eSIMs and some bill payments in 170+ countries, bought with cryptocurrency (Bitcoin, Lightning, USDC, USDT and others) or a pre-funded balance. Four documented agent paths: a hosted eCommerce MCP server (OAuth sign-in or an API key from an account), a REST API (Personal key, or Business Basic auth by application), an agent skill package with a CLI, and an x402 storefront at api.bitrefill.com/x402 that needs no Bitrefill account: browse for USDC micro-fees per call, or sign in once with a wallet signature (SIWX) and browse free, then pay each invoice in USDC.",
  "vendor": {
    "name": "Bitrefill (Airfill Prepaid AB)",
    "url": "https://www.bitrefill.com/",
    "kind": "organization"
  },
  "pricing": "paid",
  "agentAccess": {
    "noAccountNeeded": true,
    "auth": "other",
    "notes": "Re-measured 2026-09-21 and 09-28, no credentials, no payment: all 11 documented x402 routes answer 402, none 401 and none data; the 3 routes documented free answer 402 with an empty accepts array and a sign-in-with-x challenge. MCP initialize 401 (09-11, re-read 09-18 and 09-28)."
  },
  "surfaces": {
    "homepage": "https://www.bitrefill.com/",
    "docs": "https://docs.bitrefill.com/docs/api-overview",
    "llmsTxt": "https://www.bitrefill.com/llms.txt",
    "skills": [
      "https://www.bitrefill.com/agents/SKILL.md"
    ],
    "mcp": "https://api.bitrefill.com/mcp",
    "api": "https://docs.bitrefill.com/docs/api-overview",
    "source": "https://github.com/bitrefill/agents"
  },
  "social": {
    "github": "bitrefill"
  },
  "domains": [
    "bitrefill.com",
    "www.bitrefill.com"
  ],
  "maintainers": [],
  "provenance": "third-party",
  "jobs": [
    {
      "job": "proc.purchase-on-behalf",
      "summary": "Vendor's llms.txt: agents can search products, check prices and complete full purchases of gift cards, payment cards, mobile top-ups and eSIMs via MCP or REST API, delivered instantly; the skill and x402 storefront add a no-account path paid from a wallet. Claim only; no purchase was made.",
      "source": "https://www.bitrefill.com/llms.txt"
    }
  ],
  "created": "2026-09-11",
  "updated": "2026-09-28",
  "version": 6,
  "payments": {
    "machinePayable": true,
    "protocols": [
      "x402"
    ],
    "methods": [
      "stablecoin"
    ],
    "humanBilling": "invoice",
    "priceList": "https://github.com/bitrefill/agents/blob/main/skills/bitrefill/references/touchpoints/x402.md",
    "notes": "Re-measured 2026-09-21 and 09-28, no payment: every priced x402 route quotes the vendor's published price (2000 units of USDC = $0.002; 1000 = $0.001) under scheme exact, on Base, Arbitrum, Polygon and Solana. invoice/pay quotes scheme upto at 1000 USDC when no invoice resolves."
  }
}
