{
  "$schema": "https://public-agents.com/schemas/tool.schema.json",
  "schemaVersion": 1,
  "slug": "convert",
  "name": "Convert Experiences",
  "kind": "service",
  "status": "active",
  "summary": "A/B, split-URL, multivariate and personalization testing for websites (a tracking script and visual editor) and Full Stack SDKs with feature flags, aimed at mid-market e-commerce and CRO agencies. For agents: a hosted MCP server of 45 tools that signs in by Convert OAuth, a 16-tool local npm MCP server keyed by an Application ID and Secret Key, and a REST API v2 with the same keys. Every surface needs an account first; plans start at $299 per month after a 15-day free trial that needs no credit card.",
  "vendor": {
    "name": "Convert Insights, Inc.",
    "url": "https://www.convert.com/",
    "kind": "organization"
  },
  "pricing": "paid",
  "payments": {
    "machinePayable": false,
    "protocols": [],
    "methods": [],
    "humanBilling": "card-on-file",
    "priceList": "https://www.convert.com/pricing/",
    "notes": "2026-09-25: no surface read prices an agent call and no keyless request drew a 402; the authenticated side is unmeasured. Terms of service: fees are paid \"by giving your credit card information\" and Convert \"may charge that credit card a monthly fee\"; Enterprise lists \"Custom Payments & Terms\"."
  },
  "agentAccess": {
    "noAccountNeeded": false,
    "auth": "api-key",
    "notes": "Measured 2026-09-09, re-run unchanged 2026-09-16: hosted MCP initialize with no token answers 401 (empty body; Bearer realm OAuth, scope convert.mcp; its authorization server advertises a registration endpoint, client_secret_basic/post and none). REST GET /api/v2/accounts, no header: 401."
  },
  "surfaces": {
    "homepage": "https://www.convert.com/",
    "docs": "https://docs.developers.convert.com/",
    "llmsTxt": "https://docs.developers.convert.com/llms.txt",
    "mcp": "https://mcp.ai.app.convert.com/mcp",
    "api": "https://docs.developers.convert.com/reference/api-key-authentication",
    "source": null
  },
  "social": {
    "github": "convertcom"
  },
  "domains": [
    "convert.com",
    "www.convert.com"
  ],
  "maintainers": [],
  "provenance": "third-party",
  "jobs": [
    {
      "job": "mkt.ab-test-creative",
      "summary": "A/B, split-URL and multivariate experiences on web pages through the tracking script and visual editor, and server-side experiences through the Full Stack SDKs; over the MCP server an agent reads live experience and goal data and creates draft tests for review, with a human confirming activation.",
      "source": "https://www.convert.com/mcp-server"
    }
  ],
  "created": "2026-09-09",
  "updated": "2026-09-25",
  "version": 3
}
